ID tanggapan;Tanggal pengiriman;Halaman terakhir;Bahasa utama;Seed;Tanggal mulai;Tanggal tindakan terakhir;Durasi;Alamat IP;URL perujuk;Unit Asal Surveyor;Nama Surveyor;DEMOGRAFI RESPONDEN;Nama (inisial);Jenis Kelamin;Usia;Pendidikan Terakhir;Pekerjaan;Pekerjaan [Lainnya];Penghasilan;Kota;Kecamatan;Kelurahan;RT;RW;Apakah Anda penyandang disabilitas?;Apakah Anda lahir di Jakarta?;Apakah Anda besar di Jakarta?;Sebutkan kelompok etnisitas yang paling mewakili identitas Anda:;Sebutkan kelompok etnisitas yang paling mewakili identitas Anda: [Lainnya];Agama Anda:;Pertanyaan di bawah ini akan mengacu pada status keluarga responden;Status anda:;Jumlah anak;Apakah anda tinggal bersama orang tua?;Apakah anda tinggal bersama mertua?;Pertanyaan di bawah ini akan mengacu pada keadaan lokasi tempat tinggal Anda;Jenis rumah yang anda tinggali saat ini:;Jenis rumah yang anda tinggali saat ini: [Lainnya];Status kepemilikan tempat tinggal Anda;Lokasi tempat tinggal Anda;Pendingin yang paling sering Anda gunakan di rumah;Sumber air yang digunakan sehari-hari;Dibanding tahun lalu, bagaimana suhu udara di Jakarta tahun ini?;Seberapa khawatir Anda dengan dampak perubahan iklim khususnya di Jakarta?;POLA MOBILITAS;Pertanyaan di bawah ini akan mengacu pada aktivitas/pergerakan Anda dalam menggunakan transportasi;Sarana transportasi utama yang Anda gunakan sehari-hari;FREKUENSI MOBILITAS;Halaman ini akan mengacu pada seberapa sering menggunakan transportasi;Seberapa sering Anda jalan kaki dan menggunakan trotoar di luar rumah?;Seberapa sering Anda menggunakan transportasi publik (MRT, KRL, TJ, angkot)?;POLA MOBILITAS;Durasi perjalanan ke tempat kerja/kuliah/aktivitas sehari-hari;Halaman ini akan mengacu pada pertanyaan yang berkaitan dengan rasa aman baik di sosial maupun lingkungan;Seberapa Anda merasa aman di rumah (dari pencurian, perampokan, tindak kekerasan lainnya)?;Seberapa Anda merasa aman di daerah perumahan/lingkungan tempat tinggal Anda?;Seberapa Anda merasa aman ketika keluar rumah/berada di jalan raya?;Seberapa Anda merasa aman menggunakan sarana transportasi publik (KRL, MRT, TJ, dan angkot)?;Seberapa Anda merasa aman ketika keluar malam hari?;Seberapa Anda merasa aman dari risiko kebakaran?;Seberapa Anda merasa aman dari risiko banjir?;Seberapa Anda merasa aman dari risiko gempa bumi?;Seberapa Anda merasa aman dari risiko penyakit menular seperti Covid-19, TBC, HIV dan lainnya?;Seberapa Anda merasa aman dari risiko tsunami?;Seberapa Anda merasa aman dari risiko aksi terorisme?;PERBEDAAN SOSIAL;Pertanyaan di bawah ini akan mengacu pada perbedaan keyakinan dan budaya;Seberapa taat orang-orang di sekitar Anda dalam beragama?;Seberapa sering Anda taat beribadah sesuai dengan ajaran Agama yang Anda anut?;Apakah Anda setuju agama adalah urusan publik?;PERBEDAAN KEIMANAN;Halaman ini akan mengacu pada pertanyaan yang berkaitan dengan perbedaan keyakinan;Seberapa nyaman Anda bertetangga dengan orang yang berbeda agama?;Seberapa nyaman Anda untuk mengucapkan selamat hari raya pada orang yang berbeda agama?;Seberapa nyaman Anda jika anak Anda bersekolah di sekolah agama yang bukan agama Anda?;Seberapa nyaman Anda jika anak Anda bergaul dengan anak yang berbeda agama?;PERBEDAAN SOSIAL;Seberapa penting faktor agama dalam memilih rekan bisnis/sosial dibandingkan faktor kompetensi?;PERBEDAAN ETNISITAS;Halaman ini akan mengacu pada pertanyaan tentang perbedaan etnisitas;Sepenting apa identitas etnik untuk Anda?;Sepenting apa faktor etnisitas dalam pertimbangan ketika Anda memilih tempat tinggal?;Sepenting apa faktor etnisitas  dalam memilih rekan bisnis?;PERBEDAAN SOSIAL;Apakah Anda percaya faktor etnisitas membentuk perilaku dan karakter seseorang?;Adakah kelompok etnik tertentu yang Anda tidak suka?;KOHESI SOSIAL;Pertanyaan di bawah ini akan mengacu pada kondisi sosial suatu kelompok masyarakat pasca pandemi;Seberapa percaya Anda menitipkan rumah Anda kepada tetangga/orang-orang di sekitar tempat tinggal Anda?;Seberapa percaya Anda menitipkan anak/anggota keluarga Anda kepada tetangga/orang-orang di sekitar tempat tinggal Anda?;KOHESI SOSIAL_1;Halaman ini merupakan bagian dari kohesi sosial yang lebih spesifik tentang aktivitas sosial responden;Seberapa sering Anda bergaul dengan tetangga/orang-orang di sekitar tempat tinggal Anda? ;Seberapa sering Anda terlibat dalam aktivitas komunitas di daerah tempat tinggal Anda? ;Seberapa sering Anda memberi sumbangan finansial/material untuk aktivitas komunitas di tempat tinggal Anda?;KOHESI SOSIAL;Seberapa kuat Anda merasa punya tanggung jawab terhadap komunitas di mana Anda tinggal?;KOHESI SOSIAL;Halaman ini masih merupakan bagian dari variabel kohesi sosial;Seberapa sering Anda membantu orang-orang di sekitar tempat tinggal Anda?;Seberapa sering Anda dibantu orang-orang di sekitar tempat tinggal Anda?;KOHESI SOSIAL;Berapa banyak keluarga yang anda kenal baik di sekitar tempat tinggal anda?;KOHESI SOSIAL_2;Halaman ini akan mengacu pada kenyamanan dalam suatu komunitas;Seberapa nyaman Anda merasakan tinggal bersama komunitas di mana Anda berada?;Seberapa nyaman Anda merasa diterima oleh komunitas di mana Anda tinggal?;Halaman ini akan mengacu pada kepercayaan masyarakat terhadap lembaga pemerintah khususnya Provinsi DKI Jakarta;Seberapa percaya Anda pada Lembaga Penegakan Hukum Negara?;Seberapa percaya Anda pada Lembaga Pertahanan dan Keamanan Negara?;Seberapa percaya Anda terhadap perangkat pemerintah daerah DKI Jakarta yang bertugas menjaga ketertiban di masyarakat?;Seberapa percaya Anda pada pegawai Pemerintah Provinsi DKI Jakarta?;Seberapa percaya Anda pada pejabat Pemerintah Provinsi DKI Jakarta?;Seberapa percaya Anda dengan lembaga legislatif pengawas pemerintahan DKI Jakarta?;Halaman ini akan mengacu pada kemudahan akses warga terhadap layanan publik;Berdasarkan pengalaman Anda, semudah apa Anda mengurus KTP di Jakarta?;Berdasarkan pengalaman Anda, semudah apa Anda mengurus SIM di Jakarta? ;Berdasarkan pengalaman Anda, semudah apa Anda mengurus perizinan (kegiatan, pembangunan, dll.)?;Berdasarkan pengalaman Anda, semudah apa Anda mendapatkan layanan kesehatan yang disediakan Pemerintah Provinsi DKI?;Berdasarkan pengalaman anda, semudah apa anda mendapatkan layanan pendidikan (sekolah) yang disediakan Pemerintah Provinsi DKI?;Pertanyaan di bawah ini akan mengacu pada mobilitas sosial kehidupan Anda;Bagaimana Anda membandingkan kesejahteraan hidup Anda saat ini dengan kehidupan orang tua Anda di usia yang sama?;Seberapa optimis Anda dengan kehidupan masa depan anak Anda?;Apakah kualitas hidup Anda saat ini lebih baik dibanding 10 tahun yang lalu?;Pertanyaan di bawah ini akan mengacu pada pandangan masa depan Anda terhadap DKI Jakarta;Apa rencana hidup Anda di Jakarta?;Seberapa optimis anda dengan masa depan kota Jakarta?;Apakah dampak perpindahan Ibu kota negara dari Jakarta ke Kalimantan terhadap kehidupan Anda?;Waktu total;Waktu grup:;Waktu pertanyaan: ACF0;Waktu pertanyaan: ACF2;Waktu pertanyaan: A17;Waktu pertanyaan: ACF1;Waktu pertanyaan: A1;Waktu pertanyaan: A2;Waktu pertanyaan: A3;Waktu pertanyaan: A4;Waktu pertanyaan: A5;Waktu pertanyaan: A6;Waktu pertanyaan: A7;Waktu pertanyaan: A8;Waktu pertanyaan: A9;Waktu pertanyaan: A10;Waktu pertanyaan: A16;Waktu pertanyaan: A11;Waktu pertanyaan: A12;Waktu pertanyaan: A13;Waktu pertanyaan: A14;Waktu pertanyaan: A15;Waktu grup: KELUARGA;Waktu pertanyaan: B0;Waktu pertanyaan: B1;Waktu pertanyaan: B2;Waktu pertanyaan: B3;Waktu pertanyaan: B4;Waktu grup: PERUMAHAN;Waktu pertanyaan: C0;Waktu pertanyaan: C1;Waktu pertanyaan: C2;Waktu pertanyaan: C3;Waktu pertanyaan: C4;Waktu pertanyaan: C5;Waktu pertanyaan: C6;Waktu pertanyaan: C7;Waktu grup:;Waktu pertanyaan: D00;Waktu pertanyaan: D0;Waktu pertanyaan: D1;Waktu pertanyaan: D01;Waktu pertanyaan: D02;Waktu pertanyaan: D2;Waktu pertanyaan: D3;Waktu pertanyaan: D03;Waktu pertanyaan: D4;Waktu grup: RASA AMAN : SOSIAL DAN LINGKUNGAN;Waktu pertanyaan: E0;Waktu pertanyaan: E1;Waktu pertanyaan: E2;Waktu pertanyaan: E3;Waktu pertanyaan: E4;Waktu pertanyaan: E5;Waktu pertanyaan: E6;Waktu pertanyaan: E7;Waktu pertanyaan: E8;Waktu pertanyaan: E9;Waktu pertanyaan: E10;Waktu pertanyaan: E11;Waktu grup:;Waktu pertanyaan: F00;Waktu pertanyaan: F01;Waktu pertanyaan: F1;Waktu pertanyaan: F2;Waktu pertanyaan: F3;Waktu pertanyaan: F02;Waktu pertanyaan: F03;Waktu pertanyaan: F4;Waktu pertanyaan: F5;Waktu pertanyaan: F6;Waktu pertanyaan: F7;Waktu pertanyaan: F04;Waktu pertanyaan: F8;Waktu pertanyaan: F05;Waktu pertanyaan: F06;Waktu pertanyaan: F9;Waktu pertanyaan: F10;Waktu pertanyaan: F11;Waktu pertanyaan: F07;Waktu pertanyaan: F12;Waktu pertanyaan: F13;Waktu grup:;Waktu pertanyaan: G00;Waktu pertanyaan: G01;Waktu pertanyaan: G1;Waktu pertanyaan: G2;Waktu pertanyaan: G02;Waktu pertanyaan: G03;Waktu pertanyaan: G3;Waktu pertanyaan: G4;Waktu pertanyaan: G5;Waktu pertanyaan: G04;Waktu pertanyaan: G6;Waktu pertanyaan: G05;Waktu pertanyaan: G06;Waktu pertanyaan: G7;Waktu pertanyaan: G8;Waktu pertanyaan: G07;Waktu pertanyaan: G9;Waktu pertanyaan: G08;Waktu pertanyaan: G09;Waktu pertanyaan: G10;Waktu pertanyaan: G11;Waktu grup: KEPERCAYAAN PADA LEMBAGA PEMERINTAH;Waktu pertanyaan: H00;Waktu pertanyaan: H1;Waktu pertanyaan: H2;Waktu pertanyaan: H3;Waktu pertanyaan: H4;Waktu pertanyaan: H5;Waktu pertanyaan: H6;Waktu grup: AKSEBILITAS LAYANAN PUBLIK: KESEHATAN, PENDIDIKAN, ADMINISTRASI;Waktu pertanyaan: I00;Waktu pertanyaan: I1;Waktu pertanyaan: I2;Waktu pertanyaan: I3;Waktu pertanyaan: I4;Waktu pertanyaan: I5;Waktu grup: MOBILITAS SOSIAL;Waktu pertanyaan: J00;Waktu pertanyaan: J1;Waktu pertanyaan: J2;Waktu pertanyaan: J3;Waktu grup: PANDANGAN MASA DEPAN;Waktu pertanyaan: K00;Waktu pertanyaan: K1;Waktu pertanyaan: K2;Waktu pertanyaan: K3
658;13/01/2022 14:48;1;id;;13/01/2022 14:46;13/01/2022 14:48;00:02:15;;;Jakarta Smart City;Ibnu gunawan aslam;;Inu;Laki-laki;20-24 tahun;Akademi/Diploma III/S. Muda;Pegawai perusahaan swasta;;Rp 4.000.001 - Rp 6.500.000;Jakarta Selatan;KECAMATAN PANCORAN;KELURAHAN PENGADEGAN;1;2;Tidak;Ya;Ya;Tidak ingin menjawab;;Islam;;Belum menikah;03-May;Tidak;Tidak;;Unit Apartement;;Kamar kos;Jalan kecil (hanya bisa dilewati mobil satu arah);Kipas listrik;Pompa air tanah;Lebih sejuk;Kadang khawatir;;;Sepeda motor;;;Kadang-kadang;Sangat jarang;;30-60 menit;;Tidak aman;Sangat tidak aman;Sangat aman;Sangat aman;Sangat aman;Sangat aman;Sangat aman;Sangat aman;Sangat aman;Sangat aman;Sangat aman;;;Sangat tidak taat;Kadang-kadang;Tergantung situasi;;;Kadang nyaman, kadang tidak nyaman;Tidak nyaman;Tidak nyaman;Kadang nyaman, kadang tidak nyaman;;Agama tidak lebih penting dari kompetensi;;;Cukup penting;Cukup penting;Sangat penting;;Tidak;Tidak;;;Kadang percaya, kadang tidak;Kadang percaya, kadang tidak;;;Sangat sering;Sangat sering;Sangat sering;;Sangat kuat;;;Sering;Sangat sering;;7-10 keluarga;;;Kadang nyaman, kadang tidak nyaman;Kadang nyaman, kadang tidak nyaman;;Sangat tidak percaya;Cukup percaya;Cukup percaya;Cukup percaya;Sangat percaya;Sangat percaya;;Sangat mudah dan cepat;Sangat mudah dan cepat;Sangat mudah dan cepat;Sangat mudah dan cepat;Sangat mudah dan cepat;;Lebih baik;Cukup optimis;Lebih buruk;;Saya sudah menyiapkan tempat untuk pensiun di luar Jakarta;Cukup optimis Jakarta akan terus berbenah diri;Cukup positif;;;;;;;;;;;;;;;;;;;;;;;;;;;;;;;;;;;;;;;;;;;;;;;;;;;;;;;;;;;;;;;;;;;;;;;;;;;;;;;;;;;;;;;;;;;;;;;;;;;;;;;;;;;;;;;;;;;;;;;;;;;;;;;;;
587;18/01/2022 11:28;1;id;1385195360;18/01/2022 11:00;18/01/2022 11:28;00:27:58;103.82.15.246;;CPNS Diskominfotik;v;;v;Perempuan;20-24 tahun;Doktor/Strata III;Mahasiswa/pelajar;;Rp 20.000.001 - Rp 25.000.000;Kepulauan Seribu;KECAMATAN KEPULAUAN SERIBU UTARA;KELURAHAN PULAU KELAPA;8;1;Tidak;Tidak;Tidak;Tidak ingin menjawab;;Tidak ingin menjawab;;Belum menikah;0;Ya;Belum/tidak menikah;;Unit Apartement;;Menumpang (tidak bayar);Jalan raya;Tidak ada;Pipa PAM;Lebih panas;Tidak khawatir;;;Transportasi publik (transjakarta, KRL, MRT, angkot);;;Sangat sering;Sangat sering;;30-60 menit;;Cukup aman;Kadang tidak aman, kadang aman;Kadang tidak aman, kadang aman;Kadang tidak aman, kadang aman;Kadang tidak aman, kadang aman;Kadang tidak aman, kadang aman;Kadang tidak aman, kadang aman;Kadang tidak aman, kadang aman;Kadang tidak aman, kadang aman;Kadang tidak aman, kadang aman;Kadang tidak aman, kadang aman;;;Cukup taat;Cukup sering;Tidak setuju (agama urusan privat);;;Cukup nyaman;Cukup nyaman;Tidak nyaman;Cukup nyaman;;Agama tidak lebih penting dari kompetensi;;;Cukup penting;Tidak penting;Kadang penting, kadang tidak penting;;Ya;Tidak;;;Cukup percaya;Kadang percaya, kadang tidak;;;Sering;Sering;Sangat sering;;Sekali-sekali saja;;;Sekali-sekali;Sekali-sekali;;4-6 keluarga;;;Tidak nyaman;Kadang nyaman, kadang tidak nyaman;;Tidak percaya;Kadang percaya, kadang tidak percaya;Kadang percaya, kadang tidak percaya;Cukup percaya;Kadang percaya, kadang tidak percaya;Tidak percaya;;Sangat mudah dan cepat;Tidak pernah;Tidak pernah;Cukup mudah;Tidak pernah;;Lebih baik;Sangat optimis;Lebih baik;;Saya sedang mencari kesempatan untuk pindah dari Jakarta;Cukup optimis Jakarta akan terus berbenah diri;Tidak ada dampak;1678,7;;;;;;;;;;;;;;;;;;;;;;;;;;;;;;;;;;;;;;;;;;;;;;;;;;;;;;;;;;;;;;;;;;;;;;;;;;;;;;;;;;;;;;;;;;;;;;;;;;;;;;;;;;;;;;;;;;;;;;;;;;;;;;;;
602;18/01/2022 16:09;1;id;;18/01/2022 16:01;18/01/2022 16:09;00:07:40;;;Unit Pengelola Statistik;Riski Salim;;R;Laki-laki;20-24 tahun;Diploma IV/Strata I;Pegawai perusahaan swasta;;Rp 6.500.001 - Rp 9.000.000;Jakarta Selatan;KECAMATAN JAGAKARSA;KELURAHAN CIGANJUR;5;1;Tidak;Tidak;Ya;Tidak ingin menjawab;;Islam;;Belum menikah;0;Tidak;Tidak;;Rumah tapak (tanah dan bangunan);;Rumah milik penuh;Jalan kecil (hanya bisa dilewati mobil satu arah);Kipas listrik;Pipa PAM;Lebih panas;Cukup khawatir;;;Sepeda motor;;;Kadang-kadang;Kadang-kadang;;30-60 menit;;Cukup aman;Cukup aman;Kadang tidak aman, kadang aman;Cukup aman;Kadang tidak aman, kadang aman;Kadang tidak aman, kadang aman;Kadang tidak aman, kadang aman;Tidak aman;Kadang tidak aman, kadang aman;Cukup aman;Tidak aman;;;Cukup taat;Cukup sering;Cukup setuju;;;Cukup nyaman;Cukup nyaman;Tidak nyaman;Kadang nyaman, kadang tidak nyaman;;Agama sedikit lebih penting;;;Kadang penting, kadang tidak penting;Kadang penting, kadang tidak penting;Kadang penting, kadang tidak penting;;Tidak;Tidak;;;Cukup percaya;Cukup percaya;;;Sangat sering;Sangat sering;Sangat sering;;Kuat;;;Sering;Sekali-sekali;;Lebih dari 10 keluarga;;;Sangat nyaman;Cukup nyaman;;Kadang percaya, kadang tidak percaya;Tidak percaya;Cukup percaya;Cukup percaya;Cukup percaya;Kadang percaya, kadang tidak percaya;;Sangat mudah dan cepat;Cukup mudah;Cukup mudah;Cukup mudah;Cukup mudah;;Lebih baik;Sangat optimis;Lebih baik;;Saya sudah menyiapkan tempat untuk pensiun di luar Jakarta;Cukup optimis Jakarta akan terus berbenah diri;Cukup negatif;;;;;;;;;;;;;;;;;;;;;;;;;;;;;;;;;;;;;;;;;;;;;;;;;;;;;;;;;;;;;;;;;;;;;;;;;;;;;;;;;;;;;;;;;;;;;;;;;;;;;;;;;;;;;;;;;;;;;;;;;;;;;;;;;
622;18/01/2022 16:49;1;id;;18/01/2022 16:39;18/01/2022 16:49;00:09:31;;;Unit Pengelola Statistik;Midun;;Md;Laki-laki;30-34 tahun;Belum Tamat SD/Sederajat;Pegawai perusahaan swasta;;Rp 4.000.001 - Rp 6.500.000;Jakarta Pusat;KECAMATAN TANAH ABANG;KELURAHAN PETAMBURAN;5;8;Tidak;Tidak;Ya;Tidak ingin menjawab;;Islam;;Belum menikah;03-May;Ya;Tidak;;Unit Apartement;;Rumah cicilan;Jalan besar (bisa dilewati mobil dua arah);Kipas listrik;Pompa air tanah;Lebih sejuk;Tidak khawatir;;;Sepeda motor;;;Sangat jarang;Sangat jarang;;1-2 jam;;Kadang tidak aman, kadang aman;Tidak aman;Kadang tidak aman, kadang aman;Tidak aman;Tidak aman;Tidak aman;Kadang tidak aman, kadang aman;Kadang tidak aman, kadang aman;Kadang tidak aman, kadang aman;Kadang tidak aman, kadang aman;Kadang tidak aman, kadang aman;;;Kadang taat, kadang tidak taat;Kadang-kadang;Cukup setuju;;;Kadang nyaman, kadang tidak nyaman;Kadang nyaman, kadang tidak nyaman;Sangat tidak nyaman;Kadang nyaman, kadang tidak nyaman;;Agama sedikit lebih penting;;;Sangat penting;Cukup penting;Tidak penting;;Tidak;Tidak;;;Sering tidak percaya;Sering tidak percaya;;;Sangat jarang;Sekali-sekali;Sangat sering;;Jarang peduli;;;Sekali-sekali;Sangat jarang;;1-3 keluarga;;;Kadang nyaman, kadang tidak nyaman;Kadang nyaman, kadang tidak nyaman;;Cukup percaya;Kadang percaya, kadang tidak percaya;Kadang percaya, kadang tidak percaya;Tidak percaya;Cukup percaya;Kadang percaya, kadang tidak percaya;;Kadang mudah, kadang tidak;Sangat tidak mudah dan berbelit-belit;Kadang mudah, kadang tidak;Tidak mudah;Tidak mudah;;Lebih baik;Sama saja;Lebih buruk;;Saya akan terus bekerja di Jakarta dan mungkin akan pensiun di tempat lain;Jakarta akan tetap sama seperti sekarang;Sangat negatif;;;;;;;;;;;;;;;;;;;;;;;;;;;;;;;;;;;;;;;;;;;;;;;;;;;;;;;;;;;;;;;;;;;;;;;;;;;;;;;;;;;;;;;;;;;;;;;;;;;;;;;;;;;;;;;;;;;;;;;;;;;;;;;;;
621;18/01/2022 16:44;1;id;;18/01/2022 16:41;18/01/2022 16:44;00:03:23;;;Unit Pengelola Statistik;Findez;;Tes1;Laki-laki;30-34 tahun;Diploma I/II;Wirausaha (berstatus PT dan CV);;Rp 9.000.001 - Rp 14.000.000;Jakarta Utara;KECAMATAN PADEMANGAN;KELURAHAN PADEMANGAN BARAT;85;9;Ya;Tidak;Tidak;Lainnya;Betawi;Hindu;;Belum menikah;0;Tidak;Tidak;;Rumah susun;;Rumah cicilan;Jalan kecil (hanya bisa dilewati mobil satu arah);Kipas listrik;Pompa air tanah;Lebih panas;Kadang khawatir;;;Sepeda motor;;;Kadang-kadang;Kadang-kadang;;30-60 menit;;Kadang tidak aman, kadang aman;Kadang tidak aman, kadang aman;Kadang tidak aman, kadang aman;Kadang tidak aman, kadang aman;Kadang tidak aman, kadang aman;Kadang tidak aman, kadang aman;Kadang tidak aman, kadang aman;Kadang tidak aman, kadang aman;Kadang tidak aman, kadang aman;Kadang tidak aman, kadang aman;Kadang tidak aman, kadang aman;;;Cukup taat;Cukup sering;Tergantung situasi;;;Kadang nyaman, kadang tidak nyaman;Kadang nyaman, kadang tidak nyaman;Cukup nyaman;Cukup nyaman;;Agama sangat tidak penting;;;Cukup penting;Cukup penting;Cukup penting;;Tidak;Tidak;;;Kadang percaya, kadang tidak;Sering tidak percaya;;;Sangat jarang;Sangat jarang;Sangat jarang;;Tidak peduli sama sekali;;;Sangat jarang;Sekali-sekali;;7-10 keluarga;;;Cukup nyaman;Sangat tidak nyaman;;Kadang percaya, kadang tidak percaya;Kadang percaya, kadang tidak percaya;Kadang percaya, kadang tidak percaya;Tidak percaya;Sangat percaya;Tidak percaya;;Kadang mudah, kadang tidak;Sangat tidak mudah dan berbelit-belit;Sangat tidak mudah dan berbelit-belit;Sangat tidak mudah dan berbelit-belit;Sangat tidak mudah dan berbelit-belit;;Sama saja;Sama saja;Sama saja;;Saya sedang mencari kesempatan untuk pindah dari Jakarta;Jakarta akan tetap sama seperti sekarang;Tidak ada dampak;;;;;;;;;;;;;;;;;;;;;;;;;;;;;;;;;;;;;;;;;;;;;;;;;;;;;;;;;;;;;;;;;;;;;;;;;;;;;;;;;;;;;;;;;;;;;;;;;;;;;;;;;;;;;;;;;;;;;;;;;;;;;;;;;
634;18/01/2022 17:13;1;id;;18/01/2022 17:07;18/01/2022 17:13;00:06:11;;;Jaringan dan Komunikasi Data (JKD);1;;1;Laki-laki;20-24 tahun;Doktor/Strata III;Freelance/Pekerja kreatif;;Rp 14.000.001 - Rp 20.000.000;Jakarta Timur;KECAMATAN KRAMATJATI;KELURAHAN CAWANG;1;1;Tidak;Ya;Ya;Lainnya;Asik;Budha;;Menikah;01-Feb;Tidak;Tidak;;Rumah tapak (tanah dan bangunan);;Rumah milik penuh;Jalan kecil (hanya bisa dilewati mobil satu arah);AC;Pompa air tanah;Sama saja;Tidak khawatir;;;Mobil;;;Kadang-kadang;Kadang-kadang;;30-60 menit;;Kadang tidak aman, kadang aman;Kadang tidak aman, kadang aman;Kadang tidak aman, kadang aman;Kadang tidak aman, kadang aman;Kadang tidak aman, kadang aman;Kadang tidak aman, kadang aman;Kadang tidak aman, kadang aman;Kadang tidak aman, kadang aman;Kadang tidak aman, kadang aman;Kadang tidak aman, kadang aman;Kadang tidak aman, kadang aman;;;Kadang taat, kadang tidak taat;Kadang-kadang;Tergantung situasi;;;Kadang nyaman, kadang tidak nyaman;Kadang nyaman, kadang tidak nyaman;Kadang nyaman, kadang tidak nyaman;Kadang nyaman, kadang tidak nyaman;;Agama dan kompetensi sama penting;;;Kadang penting, kadang tidak penting;Kadang penting, kadang tidak penting;Kadang penting, kadang tidak penting;;Ya;Tidak;;;Kadang percaya, kadang tidak;Kadang percaya, kadang tidak;;;Sekali-sekali;Sekali-sekali;Sekali-sekali;;Sekali-sekali saja;;;Sekali-sekali;Sekali-sekali;;4-6 keluarga;;;Kadang nyaman, kadang tidak nyaman;Kadang nyaman, kadang tidak nyaman;;Kadang percaya, kadang tidak percaya;Kadang percaya, kadang tidak percaya;Kadang percaya, kadang tidak percaya;Kadang percaya, kadang tidak percaya;Kadang percaya, kadang tidak percaya;Kadang percaya, kadang tidak percaya;;Kadang mudah, kadang tidak;Kadang mudah, kadang tidak;Kadang mudah, kadang tidak;Kadang mudah, kadang tidak;Kadang mudah, kadang tidak;;Sama saja;Sama saja;Sama saja;;Saya akan terus bekerja di Jakarta dan mungkin akan pensiun di tempat lain;Jakarta akan tetap sama seperti sekarang;Tidak ada dampak;;;;;;;;;;;;;;;;;;;;;;;;;;;;;;;;;;;;;;;;;;;;;;;;;;;;;;;;;;;;;;;;;;;;;;;;;;;;;;;;;;;;;;;;;;;;;;;;;;;;;;;;;;;;;;;;;;;;;;;;;;;;;;;;;
643;18/01/2022 18:23;1;id;;18/01/2022 18:14;18/01/2022 18:23;00:09:07;;;Unit Pengelola Statistik;Adila Rachmatika;;Rachmatika;Laki-laki;25-29 tahun;Diploma IV/Strata I;Pegawai Pemerintah Non PNS (PPSU, PJLP, dll.);;Rp 4.000.001 - Rp 6.500.000;Jakarta Timur;KECAMATAN CIRACAS;KELURAHAN CIRACAS;11;10;Tidak;Tidak;Ya;Lainnya;Sunda;Islam;;Belum menikah;0;Ya;Belum/tidak menikah;;Rumah tapak (tanah dan bangunan);;Menumpang (tidak bayar);Gang (hanya bisa dilewati motor);Kipas listrik;Pipa PAM;Sama saja;Kadang khawatir;;;Sepeda motor;;;Kadang-kadang;Sangat jarang;;1-2 jam;;Cukup aman;Cukup aman;Cukup aman;Kadang tidak aman, kadang aman;Kadang tidak aman, kadang aman;Kadang tidak aman, kadang aman;Kadang tidak aman, kadang aman;Kadang tidak aman, kadang aman;Cukup aman;Sangat aman;Cukup aman;;;Kadang taat, kadang tidak taat;Kadang-kadang;Tergantung situasi;;;Cukup nyaman;Tidak nyaman;Tidak nyaman;Kadang nyaman, kadang tidak nyaman;;Agama dan kompetensi sama penting;;;Kadang penting, kadang tidak penting;Kadang penting, kadang tidak penting;Kadang penting, kadang tidak penting;;Ya;Tidak;;;Cukup percaya;Tidak punya anak/anggota keluarga yang dititipkan;;;Sangat jarang;Sangat jarang;Sekali-sekali;;Sekali-sekali saja;;;Sangat jarang;Sangat jarang;;1-3 keluarga;;;Cukup nyaman;Cukup nyaman;;Kadang percaya, kadang tidak percaya;Cukup percaya;Cukup percaya;Kadang percaya, kadang tidak percaya;Kadang percaya, kadang tidak percaya;Kadang percaya, kadang tidak percaya;;Sangat mudah dan cepat;Cukup mudah;Tidak pernah;Cukup mudah;Cukup mudah;;Sama saja;Kurang optimis;Lebih baik;;Saya sedang mencari kesempatan untuk pindah dari Jakarta;Cukup optimis Jakarta akan terus berbenah diri;Tidak ada dampak;;;;;;;;;;;;;;;;;;;;;;;;;;;;;;;;;;;;;;;;;;;;;;;;;;;;;;;;;;;;;;;;;;;;;;;;;;;;;;;;;;;;;;;;;;;;;;;;;;;;;;;;;;;;;;;;;;;;;;;;;;;;;;;;;
667;18/01/2022 19:13;1;id;;18/01/2022 18:58;18/01/2022 19:13;00:15:54;;;Jakarta Smart City;kamal (TEST);;k;Laki-laki;18-19 tahun;Belum Tamat SD/Sederajat;Aparatur Sipil Negara / Pegawai BUMN/BUMD;;Rp 6.500.001 - Rp 9.000.000;Jakarta Selatan;KECAMATAN PASAR MINGGU;KELURAHAN RAGUNAN;1;2;Tidak;Ya;Ya;Tidak ingin menjawab;;Islam;;Menikah;01-Feb;Tidak;Tidak;;Rumah susun;;Rumah milik penuh;Jalan besar (bisa dilewati mobil dua arah);Kipas listrik;Pompa air tanah;Lebih panas;Sangat tidak khawatir;;;Sepeda;;;Sangat jarang;Sangat jarang;;< 30 menit;;Tidak aman;Sangat tidak aman;Tidak aman;Tidak aman;Tidak aman;Sangat tidak aman;Kadang tidak aman, kadang aman;Sangat tidak aman;Kadang tidak aman, kadang aman;Tidak aman;Kadang tidak aman, kadang aman;;;Sangat taat;Cukup sering;Cukup setuju;;;Kadang nyaman, kadang tidak nyaman;Sangat tidak nyaman;Sangat tidak nyaman;Kadang nyaman, kadang tidak nyaman;;Agama sedikit lebih penting;;;Sangat penting;Cukup penting;Kadang penting, kadang tidak penting;;Tidak;Tidak;;;Sangat tidak percaya;Sering tidak percaya;;;Tidak pernah;Sangat jarang;Sangat jarang;;Jarang peduli;;;Tidak pernah;Sangat jarang;;7-10 keluarga;;;Sangat tidak nyaman;Tidak nyaman;;Kadang percaya, kadang tidak percaya;Tidak percaya;Kadang percaya, kadang tidak percaya;Cukup percaya;Cukup percaya;Kadang percaya, kadang tidak percaya;;Kadang mudah, kadang tidak;Tidak mudah;Sangat tidak mudah dan berbelit-belit;Kadang mudah, kadang tidak;Sangat tidak mudah dan berbelit-belit;;Lebih buruk;Tidak optimis;Jauh lebih buruk;;Saya akan terus bekerja di Jakarta dan mungkin akan pensiun di tempat lain;Tidak optimis Jakarta bisa lebih baik;Sangat negatif;;;;;;;;;;;;;;;;;;;;;;;;;;;;;;;;;;;;;;;;;;;;;;;;;;;;;;;;;;;;;;;;;;;;;;;;;;;;;;;;;;;;;;;;;;;;;;;;;;;;;;;;;;;;;;;;;;;;;;;;;;;;;;;;;
