873;19/01/2022 11:49;1;id;1211204564;19/01/2022 11:32;19/01/2022 11:49;00:17:27;114.124.183.254;;Suku Dinas Jakarta Pusat;Frizky Gautama Afif;;Y;Perempuan;35-39 tahun;Diploma IV/Strata I;Sektor informal (warung, pedagang kaki lima, parkir, dsb);;Rp 1.500.001 - Rp 4.000.000;Jakarta Pusat;KECAMATAN TANAH ABANG;KELURAHAN KARET TENGSIN;12;7;Tidak;Ya;Tidak;Lainnya;Jawa;Islam;;Menikah;01-Feb;Tidak;Ya;;Rumah tapak (tanah dan bangunan);;Rumah milik penuh;Jalan kecil (hanya bisa dilewati mobil satu arah);Kipas listrik;Pipa PAM;Sama saja;Cukup khawatir;;;Sepeda motor;;;Kadang-kadang;Tidak pernah;;< 30 menit;;Sangat aman;Sangat aman;Tidak aman;Kadang tidak aman, kadang aman;Kadang tidak aman, kadang aman;Kadang tidak aman, kadang aman;Tidak aman;Tidak aman;Cukup aman;Sangat aman;Cukup aman;;;Cukup taat;Kadang-kadang;Tergantung situasi;;;Cukup nyaman;Kadang nyaman, kadang tidak nyaman;Tidak nyaman;Cukup nyaman;;Agama dan kompetensi sama penting;;;Tidak penting;Kadang penting, kadang tidak penting;Tidak penting;;Ya;Tidak;;;Cukup percaya;Sangat percaya;;;Sering;Sekali-sekali;Sekali-sekali;;Kuat;;;Sekali-sekali;Sekali-sekali;;Lebih dari 10 keluarga;;;Sangat nyaman;Sangat nyaman;;Cukup percaya;Sangat percaya;Sangat percaya;Sangat percaya;Cukup percaya;Cukup percaya;;Sangat mudah dan cepat;Cukup mudah;Sangat mudah dan cepat;Sangat mudah dan cepat;Sangat mudah dan cepat;;Lebih baik;Cukup optimis;Lebih baik;;Saya sudah menyiapkan tempat untuk pensiun di luar Jakarta;Cukup optimis Jakarta akan terus berbenah diri;Tidak ada dampak;1039,72;;;;;;;;;;;;;;;;;;;;;;;;;;;;;;;;;;;;;;;;;;;;;;;;;;;;;;;;;;;;;;;;;;;;;;;;;;;;;;;;;;;;;;;;;;;;;;;;;;;;;;;;;;;;;;;;;;;;;;;;;;;;;;;;
884;19/01/2022 11:56;1;id;;19/01/2022 11:36;19/01/2022 11:56;00:19:41;;;Unit Pengelola Statistik;Ugih Hendarsyah;;Agustinus;Laki-laki;50-54 tahun;Diploma IV/Strata I;Freelance/Pekerja kreatif;;Rp 14.000.001 - Rp 20.000.000;Jakarta Timur;KECAMATAN DUREN SAWIT;KELURAHAN KLENDER;9;3;Tidak;Ya;Ya;Lainnya;Jawa;Katolik;;Menikah;01-Feb;Tidak;Ya;;Rumah tapak (tanah dan bangunan);;Rumah milik penuh;Jalan besar (bisa dilewati mobil dua arah);AC;Pipa PAM;Lebih panas;Tidak khawatir;;;Sepeda motor;;;Sangat jarang;Sangat jarang;;30-60 menit;;Kadang tidak aman, kadang aman;Kadang tidak aman, kadang aman;Kadang tidak aman, kadang aman;Kadang tidak aman, kadang aman;Kadang tidak aman, kadang aman;Kadang tidak aman, kadang aman;Tidak aman;Cukup aman;Kadang tidak aman, kadang aman;Cukup aman;Cukup aman;;;Cukup taat;Selalu;Tidak setuju (agama urusan privat);;;Kadang nyaman, kadang tidak nyaman;Sangat nyaman;Kadang nyaman, kadang tidak nyaman;Cukup nyaman;;Agama tidak lebih penting dari kompetensi;;;Tidak penting;Sangat tidak penting;Sangat tidak penting;;Tidak;Tidak;;;Cukup percaya;Cukup percaya;;;Sekali-sekali;Sekali-sekali;Sekali-sekali;;Sekali-sekali saja;;;Sekali-sekali;Sekali-sekali;;Lebih dari 10 keluarga;;;Cukup nyaman;Cukup nyaman;;Cukup percaya;Cukup percaya;Cukup percaya;Cukup percaya;Cukup percaya;Cukup percaya;;Cukup mudah;Cukup mudah;Tidak pernah;Cukup mudah;Cukup mudah;;Lebih baik;Cukup optimis;Lebih baik;;Saya akan terus bekerja di Jakarta dan mungkin akan pensiun di tempat lain;Cukup optimis Jakarta akan terus berbenah diri;Cukup positif;;;;;;;;;;;;;;;;;;;;;;;;;;;;;;;;;;;;;;;;;;;;;;;;;;;;;;;;;;;;;;;;;;;;;;;;;;;;;;;;;;;;;;;;;;;;;;;;;;;;;;;;;;;;;;;;;;;;;;;;;;;;;;;;;
874;19/01/2022 12:02;1;id;260161596;19/01/2022 11:39;19/01/2022 12:02;00:23:30;182.0.140.235;;Jakarta Smart City;Aryo Iswan Khodrianto;;DP;Perempuan;25-29 tahun;SLTA/Sederajat;Pegawai perusahaan swasta;;Rp 4.000.001 - Rp 6.500.000;Jakarta Barat;KECAMATAN TAMANSARI;KELURAHAN MANGGA BESAR;3;3;Tidak;Ya;Ya;Lainnya;jawa;Islam;;Menikah;0;Tidak;Tidak;;Rumah tapak (tanah dan bangunan);;Rumah kontrak;Jalan besar (bisa dilewati mobil dua arah);Kipas listrik;Pipa PAM;Lebih sejuk;Cukup khawatir;;;Sepeda motor;;;Sangat sering;Sangat jarang;;< 30 menit;;Tidak aman;Kadang tidak aman, kadang aman;Tidak aman;Kadang tidak aman, kadang aman;Tidak aman;Cukup aman;Cukup aman;Cukup aman;Cukup aman;Cukup aman;Cukup aman;;;Cukup taat;Cukup sering;Cukup setuju;;;Cukup nyaman;Cukup nyaman;Tidak nyaman;Cukup nyaman;;Agama sedikit lebih penting;;;Cukup penting;Cukup penting;Cukup penting;;Ya;Tidak;;;Sangat tidak percaya;Sangat tidak percaya;;;Sering;Sering;Sering;;Kuat;;;Sering;Sekali-sekali;;7-10 keluarga;;;Cukup nyaman;Cukup nyaman;;Cukup percaya;Cukup percaya;Cukup percaya;Cukup percaya;Cukup percaya;Cukup percaya;;Cukup mudah;Cukup mudah;Cukup mudah;Cukup mudah;Cukup mudah;;Jauh lebih baik;Sangat optimis;Jauh lebih baik;;Saya akan terus bekerja di Jakarta dan mungkin akan pensiun di tempat lain;Sangat optimis Jakarta akan lebih baik;Tidak ada dampak;1383,69;;;;;;;;;;;;;;;;;;;;;;;;;;;;;;;;;;;;;;;;;;;;;;;;;;;;;;;;;;;;;;;;;;;;;;;;;;;;;;;;;;;;;;;;;;;;;;;;;;;;;;;;;;;;;;;;;;;;;;;;;;;;;;;;
876;19/01/2022 12:14;1;id;1000452235;19/01/2022 11:41;19/01/2022 12:14;00:33:19;202.180.29.66;;Unit Pengelola Statistik;Muhamad Septia Andi Akbarsyah;;Sugeng Marwanto;Laki-laki;50-54 tahun;Akademi/Diploma III/S. Muda;Pegawai perusahaan swasta;;Rp 4.000.001 - Rp 6.500.000;Jakarta Utara;KECAMATAN TANJUNG PRIOK;KELURAHAN SUNTER AGUNG;3;10;Tidak;Ya;Ya;Lainnya;Jawa;Islam;;Belum menikah;Tidak Tahu;Tidak;Belum/tidak menikah;;Rumah tapak (tanah dan bangunan);;Rumah milik penuh;Gang (hanya bisa dilewati motor);Kipas listrik;Pipa PAM;Sama saja;Kadang khawatir;;;Sepeda motor;;;Kadang-kadang;Tidak pernah;;>2 jam;;Sangat aman;Sangat aman;Cukup aman;Kadang tidak aman, kadang aman;Sangat aman;Kadang tidak aman, kadang aman;Tidak aman;Kadang tidak aman, kadang aman;Cukup aman;Kadang tidak aman, kadang aman;Sangat aman;;;Sangat taat;Kadang-kadang;Tergantung situasi;;;Sangat nyaman;Kadang nyaman, kadang tidak nyaman;Sangat nyaman;Sangat nyaman;;Agama sedikit lebih penting;;;Sangat penting;Sangat penting;Tidak penting;;Ya;Ya;;;Cukup percaya;Tidak punya anak/anggota keluarga yang dititipkan;;;Sangat sering;Sangat sering;Sangat sering;;Sangat kuat;;;Sekali-sekali;Sekali-sekali;;Lebih dari 10 keluarga;;;Sangat nyaman;Sangat nyaman;;Tidak percaya;Kadang percaya, kadang tidak percaya;Kadang percaya, kadang tidak percaya;Sangat percaya;Cukup percaya;Tidak percaya;;Sangat mudah dan cepat;Sangat tidak mudah dan berbelit-belit;Kadang mudah, kadang tidak;Sangat mudah dan cepat;Sangat mudah dan cepat;;Jauh lebih baik;Cukup optimis;Jauh lebih baik;;Saya akan menghabiskan hidup di Jakarta;Sangat optimis Jakarta akan lebih baik;Tidak ada dampak;1071,01;;;;;;;;;;;;;;;;;;;;;;;;;;;;;;;;;;;;;;;;;;;;;;;;;;;;;;;;;;;;;;;;;;;;;;;;;;;;;;;;;;;;;;;;;;;;;;;;;;;;;;;;;;;;;;;;;;;;;;;;;;;;;;;;
882;19/01/2022 11:50;1;id;;19/01/2022 11:42;19/01/2022 11:50;00:08:36;;;Jakarta Smart City;Muhammad Kemal Hasan;;SSN;Perempuan;40-44 tahun;SLTP/Sederajat;Pegawai Pemerintah Non PNS (PPSU, PJLP, dll.);;Rp 4.000.001 - Rp 6.500.000;Jakarta Pusat;KECAMATAN SENEN;KELURAHAN KENARI;2;4;Tidak;Ya;Ya;Lainnya;Sunda;Islam;;Menikah;01-Feb;Ya;Tidak;;Rumah tapak (tanah dan bangunan);;Rumah milik penuh;Jalan besar (bisa dilewati mobil dua arah);AC;Pipa PAM;Sama saja;Kadang khawatir;;;Sepeda motor;;;Kadang-kadang;Kadang-kadang;;< 30 menit;;Kadang tidak aman, kadang aman;Kadang tidak aman, kadang aman;Kadang tidak aman, kadang aman;Kadang tidak aman, kadang aman;Kadang tidak aman, kadang aman;Kadang tidak aman, kadang aman;Cukup aman;Kadang tidak aman, kadang aman;Kadang tidak aman, kadang aman;Cukup aman;Cukup aman;;;Cukup taat;Cukup sering;Tidak setuju (agama urusan privat);;;Sangat nyaman;Sangat nyaman;Cukup nyaman;Cukup nyaman;;Agama dan kompetensi sama penting;;;Cukup penting;Kadang penting, kadang tidak penting;Kadang penting, kadang tidak penting;;Ya;Tidak;;;Sangat percaya;Sangat percaya;;;Sering;Sering;Sering;;Kuat;;;Sering;Sering;;Lebih dari 10 keluarga;;;Cukup nyaman;Cukup nyaman;;Cukup percaya;Cukup percaya;Cukup percaya;Cukup percaya;Cukup percaya;Cukup percaya;;Sangat mudah dan cepat;Kadang mudah, kadang tidak;Cukup mudah;Cukup mudah;Cukup mudah;;Sama saja;Cukup optimis;Lebih baik;;Saya akan menghabiskan hidup di Jakarta;Cukup optimis Jakarta akan terus berbenah diri;Tidak ada dampak;;;;;;;;;;;;;;;;;;;;;;;;;;;;;;;;;;;;;;;;;;;;;;;;;;;;;;;;;;;;;;;;;;;;;;;;;;;;;;;;;;;;;;;;;;;;;;;;;;;;;;;;;;;;;;;;;;;;;;;;;;;;;;;;;
883;19/01/2022 11:53;1;id;;19/01/2022 11:42;19/01/2022 11:53;00:11:16;;;Pusat Data;dias;;rahmat;Laki-laki;45-49 tahun;SLTA/Sederajat;Wirausaha (berstatus PT dan CV);;Rp 1.500.001 - Rp 4.000.000;Jakarta Selatan;KECAMATAN TEBET;KELURAHAN BUKIT DURI;3;12;Tidak;Ya;Ya;Lainnya;betawi;Islam;;Menikah;01-Feb;Tidak;Tidak;;Rumah tapak (tanah dan bangunan);;Rumah milik penuh;Gang (hanya bisa dilewati motor);Kipas listrik;Pompa air tanah;Sama saja;Cukup khawatir;;;Sepeda motor;;;Kadang-kadang;Kadang-kadang;;< 30 menit;;Sangat aman;Kadang tidak aman, kadang aman;Cukup aman;Cukup aman;Kadang tidak aman, kadang aman;Kadang tidak aman, kadang aman;Kadang tidak aman, kadang aman;Sangat aman;Cukup aman;Sangat aman;Sangat aman;;;Sangat taat;Cukup sering;Sangat tidak setuju (agama urusan privat yang lepas dari campurtangan pemerintah);;;Cukup nyaman;Cukup nyaman;Cukup nyaman;Cukup nyaman;;Agama tidak lebih penting dari kompetensi;;;Tidak penting;Tidak penting;Tidak penting;;Tidak;Tidak;;;Sangat percaya;Sangat percaya;;;Sangat sering;Sekali-sekali;Sekali-sekali;;Kuat;;;Sekali-sekali;Sekali-sekali;;Lebih dari 10 keluarga;;;Cukup nyaman;Sangat nyaman;;Kadang percaya, kadang tidak percaya;Kadang percaya, kadang tidak percaya;Cukup percaya;Cukup percaya;Kadang percaya, kadang tidak percaya;Tidak percaya;;Cukup mudah;Cukup mudah;Cukup mudah;Cukup mudah;Kadang mudah, kadang tidak;;Lebih baik;Cukup optimis;Jauh lebih baik;;Saya sudah menyiapkan tempat untuk pensiun di luar Jakarta;Cukup optimis Jakarta akan terus berbenah diri;Tidak ada dampak;;;;;;;;;;;;;;;;;;;;;;;;;;;;;;;;;;;;;;;;;;;;;;;;;;;;;;;;;;;;;;;;;;;;;;;;;;;;;;;;;;;;;;;;;;;;;;;;;;;;;;;;;;;;;;;;;;;;;;;;;;;;;;;;;
926;19/01/2022 12:21;1;id;;19/01/2022 11:44;19/01/2022 12:21;00:36:54;;;Sekretariat;MEVY NUR ERAJELY;;S;Perempuan;60-64 tahun;SLTA/Sederajat;Ibu rumah tangga;;< Rp 1.500.000;Jakarta Pusat;KECAMATAN TANAH ABANG;KELURAHAN PETAMBURAN;10;3;Tidak;Ya;Ya;Lainnya;Betawi;Islam;;Menikah;03-May;Tidak;Tidak;;Rumah tapak (tanah dan bangunan);;Rumah milik penuh;Gang (hanya bisa dilewati motor);Kipas listrik;Pipa PAM;Lebih sejuk;Cukup khawatir;;;Jalan kaki;;;Sangat sering;Kadang-kadang;;< 30 menit;;Cukup aman;Cukup aman;Tidak aman;Cukup aman;Kadang tidak aman, kadang aman;Tidak aman;Tidak aman;Tidak aman;Tidak aman;Tidak aman;Tidak aman;;;Cukup taat;Cukup sering;Tidak setuju (agama urusan privat);;;Cukup nyaman;Tidak nyaman;Tidak nyaman;Tidak nyaman;;Agama tidak lebih penting dari kompetensi;;;Tidak penting;Tidak penting;Tidak penting;;Ya;Tidak;;;Cukup percaya;Tidak punya anak/anggota keluarga yang dititipkan;;;Sering;Sering;Sering;;Sekali-sekali saja;;;Sering;Sangat jarang;;Lebih dari 10 keluarga;;;Cukup nyaman;Cukup nyaman;;Cukup percaya;Cukup percaya;Kadang percaya, kadang tidak percaya;Kadang percaya, kadang tidak percaya;Kadang percaya, kadang tidak percaya;Kadang percaya, kadang tidak percaya;;Cukup mudah;Tidak pernah;Tidak pernah;Cukup mudah;Cukup mudah;;Lebih baik;Cukup optimis;Lebih baik;;Saya akan menghabiskan hidup di Jakarta;Sangat optimis Jakarta akan lebih baik;Cukup negatif;;;;;;;;;;;;;;;;;;;;;;;;;;;;;;;;;;;;;;;;;;;;;;;;;;;;;;;;;;;;;;;;;;;;;;;;;;;;;;;;;;;;;;;;;;;;;;;;;;;;;;;;;;;;;;;;;;;;;;;;;;;;;;;;;
885;19/01/2022 11:56;1;id;;19/01/2022 11:45;19/01/2022 11:56;00:11:33;;;Unit Pengelola Statistik;Zaky Arsyi;;T;Perempuan;40-44 tahun;SLTP/Sederajat;Sopir layanan online;;Rp 1.500.001 - Rp 4.000.000;Jakarta Barat;KECAMATAN KEBON JERUK;KELURAHAN KEDOYA UTARA;3;3;Tidak;Tidak;Tidak;Lainnya;Jawa Tengah;Islam;;Menikah;01-Feb;Tidak;Tidak;;Rumah tapak (tanah dan bangunan);;Rumah milik penuh;Gang (hanya bisa dilewati motor);Kipas listrik;Pipa PAM;Sama saja;Tidak khawatir;;;Sepeda motor;;;Sangat jarang;Kadang-kadang;;30-60 menit;;Cukup aman;Cukup aman;Sangat tidak aman;Sangat aman;Sangat tidak aman;Cukup aman;Sangat tidak aman;Sangat aman;Sangat aman;Sangat aman;Sangat aman;;;Kadang taat, kadang tidak taat;Kadang-kadang;Sangat setuju;;;Cukup nyaman;Sangat tidak nyaman;Sangat nyaman;Sangat nyaman;;Agama sangat tidak penting;;;Tidak penting;Tidak penting;Tidak penting;;Tidak;Tidak;;;Cukup percaya;Cukup percaya;;;Sangat jarang;Sangat jarang;Sangat jarang;;Sekali-sekali saja;;;Sangat jarang;Sekali-sekali;;Lebih dari 10 keluarga;;;Sangat nyaman;Sangat nyaman;;Cukup percaya;Sangat percaya;Tidak percaya;Sangat percaya;Sangat percaya;Kadang percaya, kadang tidak percaya;;Sangat mudah dan cepat;Sangat mudah dan cepat;Tidak pernah;Tidak pernah;Cukup mudah;;Lebih baik;Sangat optimis;Lebih baik;;Saya akan terus bekerja di Jakarta dan mungkin akan pensiun di tempat lain;Jakarta akan tetap sama seperti sekarang;Tidak ada dampak;;;;;;;;;;;;;;;;;;;;;;;;;;;;;;;;;;;;;;;;;;;;;;;;;;;;;;;;;;;;;;;;;;;;;;;;;;;;;;;;;;;;;;;;;;;;;;;;;;;;;;;;;;;;;;;;;;;;;;;;;;;;;;;;;
907;19/01/2022 12:17;1;id;;19/01/2022 11:48;19/01/2022 12:17;00:29:04;;;Suku Dinas Jakarta Pusat;Yesicha sinuhaji;;A;Laki-laki;40-44 tahun;Tamat SD/Sederajat;Lainnya;Ppsu;Rp 4.000.001 - Rp 6.500.000;Jakarta Pusat;KECAMATAN CEMPAKA PUTIH;KELURAHAN CEMPAKA PUTIH BARAT;10;5;Tidak;Tidak;Tidak;Lainnya;;Islam;;Menikah;01-Feb;Tidak;Tidak;;Lainnya;Kontrakan;Rumah kontrak;Jalan raya;Kipas listrik;Pipa PAM;Lebih sejuk;Sangat tidak khawatir;;;Sepeda motor;;;Tidak pernah;Tidak pernah;;< 30 menit;;Sangat aman;Sangat aman;Sangat aman;Sangat aman;Sangat aman;Sangat aman;Cukup aman;Tidak aman;Tidak aman;Tidak aman;Tidak aman;;;Sangat taat;Selalu;Tidak setuju (agama urusan privat);;;Cukup nyaman;Cukup nyaman;Tidak nyaman;Tidak nyaman;;Agama tidak lebih penting dari kompetensi;;;Sangat penting;Kadang penting, kadang tidak penting;Cukup penting;;Ya;Tidak;;;Sangat percaya;Sangat tidak percaya;;;Sering;Sangat jarang;Sangat sering;;Sangat kuat;;;Sangat sering;Sering;;1-3 keluarga;;;Sangat nyaman;Sangat nyaman;;Sangat tidak percaya;Sangat tidak percaya;Sangat percaya;Sangat percaya;Sangat percaya;Kadang percaya, kadang tidak percaya;;Sangat mudah dan cepat;Sangat mudah dan cepat;Sangat mudah dan cepat;Sangat mudah dan cepat;Sangat mudah dan cepat;;Lebih baik;Sangat optimis;Jauh lebih baik;;Saya akan menghabiskan hidup di Jakarta;Sangat optimis Jakarta akan lebih baik;Tidak ada dampak;;;;;;;;;;;;;;;;;;;;;;;;;;;;;;;;;;;;;;;;;;;;;;;;;;;;;;;;;;;;;;;;;;;;;;;;;;;;;;;;;;;;;;;;;;;;;;;;;;;;;;;;;;;;;;;;;;;;;;;;;;;;;;;;;
897;19/01/2022 12:02;1;id;;19/01/2022 11:48;19/01/2022 12:02;00:13:49;;;Unit Pengelola Statistik;Fahim;;Johan Wahyudi;Laki-laki;45-49 tahun;SLTA/Sederajat;Freelance/Pekerja kreatif;;Rp 1.500.001 - Rp 4.000.000;Jakarta Selatan;KECAMATAN CILANDAK;KELURAHAN CILANDAK BARAT;4;6;Tidak;Ya;Ya;Lainnya;Betawi;Islam;;Menikah;01-Feb;Tidak;Tidak;;Rumah tapak (tanah dan bangunan);;Rumah milik penuh;Jalan kecil (hanya bisa dilewati mobil satu arah);AC;Pompa air tanah;Sama saja;Cukup khawatir;;;Sepeda motor;;;Kadang-kadang;Sangat jarang;;< 30 menit;;Cukup aman;Cukup aman;Cukup aman;Cukup aman;Kadang tidak aman, kadang aman;Cukup aman;Cukup aman;Cukup aman;Tidak aman;Sangat aman;Cukup aman;;;Sangat taat;Selalu;Sangat setuju;;;Cukup nyaman;Tidak nyaman;Sangat tidak nyaman;Cukup nyaman;;Agama dan kompetensi sama penting;;;Tidak penting;Cukup penting;Kadang penting, kadang tidak penting;;Ya;Ya;;;Cukup percaya;Cukup percaya;;;Sangat sering;Sering;Sekali-sekali;;Kuat;;;Sekali-sekali;Sangat jarang;;Lebih dari 10 keluarga;;;Cukup nyaman;Sangat nyaman;;Kadang percaya, kadang tidak percaya;Cukup percaya;Sangat percaya;Cukup percaya;Cukup percaya;Cukup percaya;;Sangat mudah dan cepat;Kadang mudah, kadang tidak;Tidak mudah;Cukup mudah;Cukup mudah;;Sama saja;Cukup optimis;Sama saja;;Saya akan menghabiskan hidup di Jakarta;Cukup optimis Jakarta akan terus berbenah diri;Tidak ada dampak;;;;;;;;;;;;;;;;;;;;;;;;;;;;;;;;;;;;;;;;;;;;;;;;;;;;;;;;;;;;;;;;;;;;;;;;;;;;;;;;;;;;;;;;;;;;;;;;;;;;;;;;;;;;;;;;;;;;;;;;;;;;;;;;;
888;19/01/2022 11:58;1;id;;19/01/2022 11:50;19/01/2022 11:58;00:08:06;;;Jaringan dan Komunikasi Data (JKD);Sajatino Tauhid;;Frensa;Perempuan;20-24 tahun;SLTA/Sederajat;Mahasiswa/pelajar;;< Rp 1.500.000;Jakarta Pusat;KECAMATAN TANAH ABANG;KELURAHAN BENDUNGAN HILIR;1;8;Tidak;Tidak;Ya;Tidak ingin menjawab;;Kristen Protestan;;Belum menikah;0;Ya;Belum/tidak menikah;;Rumah susun;;Rumah kontrak;Gang sempit (tidak dapat dilewati kendaraan sama sekali);Kipas listrik;Pipa PAM;Sama saja;Cukup khawatir;;;Transportasi publik (transjakarta, KRL, MRT, angkot);;;Sangat sering;Sangat sering;;< 30 menit;;Cukup aman;Sangat aman;Cukup aman;Sangat aman;Cukup aman;Cukup aman;Sangat aman;Cukup aman;Sangat aman;Sangat aman;Sangat aman;;;Cukup taat;Selalu;Sangat setuju;;;Sangat nyaman;Kadang nyaman, kadang tidak nyaman;Cukup nyaman;Sangat nyaman;;Agama lebih penting;;;Kadang penting, kadang tidak penting;Sangat penting;Cukup penting;;Ya;Tidak;;;Cukup percaya;Kadang percaya, kadang tidak;;;Sering;Sering;Sekali-sekali;;Sekali-sekali saja;;;Sering;Sering;;Lebih dari 10 keluarga;;;Cukup nyaman;Cukup nyaman;;Sangat percaya;Sangat percaya;Sangat percaya;Sangat percaya;Sangat percaya;Sangat percaya;;Cukup mudah;Cukup mudah;Cukup mudah;Cukup mudah;Cukup mudah;;Jauh lebih baik;Sangat optimis;Jauh lebih baik;;Saya akan menghabiskan hidup di Jakarta;Cukup optimis Jakarta akan terus berbenah diri;Cukup positif;;;;;;;;;;;;;;;;;;;;;;;;;;;;;;;;;;;;;;;;;;;;;;;;;;;;;;;;;;;;;;;;;;;;;;;;;;;;;;;;;;;;;;;;;;;;;;;;;;;;;;;;;;;;;;;;;;;;;;;;;;;;;;;;;
894;19/01/2022 12:00;1;id;;19/01/2022 11:51;19/01/2022 12:00;00:09:15;;;Jakarta Smart City;Muhammad kemal hasan;;SH;Laki-laki;40-44 tahun;SLTA/Sederajat;Sektor informal (warung, pedagang kaki lima, parkir, dsb);;Rp 1.500.001 - Rp 4.000.000;Jakarta Pusat;KECAMATAN SENEN;KELURAHAN KENARI;6;2;Tidak;Ya;Ya;Lainnya;Betawi;Islam;;Menikah;03-May;Tidak;Ya;;Rumah tapak (tanah dan bangunan);;Rumah milik penuh;Jalan besar (bisa dilewati mobil dua arah);Kipas listrik;Pipa PAM;Jauh lebih panas;Cukup khawatir;;;Sepeda motor;;;Sangat jarang;Sangat jarang;;< 30 menit;;Sangat aman;Sangat aman;Sangat aman;Kadang tidak aman, kadang aman;Sangat aman;Kadang tidak aman, kadang aman;Cukup aman;Cukup aman;Cukup aman;Sangat aman;Sangat aman;;;Sangat taat;Selalu;Tergantung situasi;;;Sangat nyaman;Cukup nyaman;Tidak nyaman;Sangat nyaman;;Agama dan kompetensi sama penting;;;Cukup penting;Kadang penting, kadang tidak penting;Kadang penting, kadang tidak penting;;Tidak;Tidak;;;Sangat percaya;Sangat percaya;;;Sering;Sering;Sekali-sekali;;Kuat;;;Sekali-sekali;Sangat sering;;Lebih dari 10 keluarga;;;Sangat nyaman;Sangat nyaman;;Sangat percaya;Sangat percaya;Sangat percaya;Sangat percaya;Sangat percaya;Sangat percaya;;Sangat mudah dan cepat;Cukup mudah;Sangat mudah dan cepat;Sangat mudah dan cepat;Sangat mudah dan cepat;;Lebih baik;Sangat optimis;Jauh lebih baik;;Saya akan menghabiskan hidup di Jakarta;Sangat optimis Jakarta akan lebih baik;Tidak ada dampak;;;;;;;;;;;;;;;;;;;;;;;;;;;;;;;;;;;;;;;;;;;;;;;;;;;;;;;;;;;;;;;;;;;;;;;;;;;;;;;;;;;;;;;;;;;;;;;;;;;;;;;;;;;;;;;;;;;;;;;;;;;;;;;;;
901;19/01/2022 12:06;1;id;;19/01/2022 11:52;19/01/2022 12:06;00:14:28;;;Unit Pengelola Statistik;Sangkar Sandi Damai;;Sidatullah;Laki-laki;50-54 tahun;SLTA/Sederajat;Lainnya;Penanganan Prasana dan Sarana Umum Keluruhan;Rp 1.500.001 - Rp 4.000.000;Jakarta Pusat;KECAMATAN MENTENG;KELURAHAN PEGANGSAAN;14;6;Tidak;Ya;Ya;Lainnya;Betawi;Islam;;Menikah;03-May;Tidak;Tidak;;Rumah tapak (tanah dan bangunan);;Rumah kontrak;Gang (hanya bisa dilewati motor);Kipas listrik;Pipa PAM;Sama saja;Tidak khawatir;;;Sepeda motor;;;Sangat sering;Kadang-kadang;;< 30 menit;;Cukup aman;Cukup aman;Cukup aman;Cukup aman;Kadang tidak aman, kadang aman;Kadang tidak aman, kadang aman;Cukup aman;Cukup aman;Cukup aman;Cukup aman;Cukup aman;;;Cukup taat;Cukup sering;Tidak setuju (agama urusan privat);;;Sangat nyaman;Sangat tidak nyaman;Sangat tidak nyaman;Cukup nyaman;;Agama lebih penting;;;Kadang penting, kadang tidak penting;Tidak penting;Sangat tidak penting;;Ya;Tidak;;;Kadang percaya, kadang tidak;Kadang percaya, kadang tidak;;;Sering;Sekali-sekali;Sekali-sekali;;Sangat kuat;;;Sekali-sekali;Sangat jarang;;Lebih dari 10 keluarga;;;Cukup nyaman;Cukup nyaman;;Kadang percaya, kadang tidak percaya;Sangat percaya;Cukup percaya;Cukup percaya;Cukup percaya;Cukup percaya;;Cukup mudah;Cukup mudah;Cukup mudah;Sangat mudah dan cepat;Sangat mudah dan cepat;;Lebih baik;Cukup optimis;Lebih baik;;Saya akan terus bekerja di Jakarta dan mungkin akan pensiun di tempat lain;Sangat tidak optimis Jakarta bisa membaik;Tidak ada dampak;;;;;;;;;;;;;;;;;;;;;;;;;;;;;;;;;;;;;;;;;;;;;;;;;;;;;;;;;;;;;;;;;;;;;;;;;;;;;;;;;;;;;;;;;;;;;;;;;;;;;;;;;;;;;;;;;;;;;;;;;;;;;;;;;
903;19/01/2022 12:12;1;id;;19/01/2022 11:53;19/01/2022 12:12;00:19:03;;;Jaringan dan Komunikasi Data (JKD);Sajatino Tauhid;;Sommy permana;Laki-laki;40-44 tahun;Diploma IV/Strata I;Pegawai perusahaan swasta;;Rp 1.500.001 - Rp 4.000.000;Jakarta Pusat;KECAMATAN TANAH ABANG;KELURAHAN BENDUNGAN HILIR;3;8;Tidak;Tidak;Tidak;Tidak ingin menjawab;;Islam;;Menikah;01-Feb;Tidak;Tidak;;Rumah susun;;Rumah milik penuh;Jalan besar (bisa dilewati mobil dua arah);AC;Pipa PAM;Lebih panas;Sangat khawatir;;;Jalan kaki;;;Sangat sering;Tidak pernah;;< 30 menit;;Cukup aman;Cukup aman;Cukup aman;Cukup aman;Cukup aman;Cukup aman;Cukup aman;Tidak aman;Cukup aman;Tidak aman;Tidak aman;;;Kadang taat, kadang tidak taat;Selalu;Tergantung situasi;;;Cukup nyaman;Cukup nyaman;Tidak nyaman;Kadang nyaman, kadang tidak nyaman;;Agama dan kompetensi sama penting;;;Sangat penting;Cukup penting;Cukup penting;;Tidak;Tidak;;;Kadang percaya, kadang tidak;Kadang percaya, kadang tidak;;;Sekali-sekali;Sangat jarang;Sekali-sekali;;Sekali-sekali saja;;;Sekali-sekali;Sekali-sekali;;Lebih dari 10 keluarga;;;Sangat nyaman;Sangat nyaman;;Cukup percaya;Cukup percaya;Sangat percaya;Sangat percaya;Sangat percaya;Sangat percaya;;Sangat mudah dan cepat;Cukup mudah;Sangat mudah dan cepat;Sangat mudah dan cepat;Sangat mudah dan cepat;;Lebih baik;Sangat optimis;Sama saja;;Saya sedang mencari kesempatan untuk pindah dari Jakarta;Sangat optimis Jakarta akan lebih baik;Tidak ada dampak;;;;;;;;;;;;;;;;;;;;;;;;;;;;;;;;;;;;;;;;;;;;;;;;;;;;;;;;;;;;;;;;;;;;;;;;;;;;;;;;;;;;;;;;;;;;;;;;;;;;;;;;;;;;;;;;;;;;;;;;;;;;;;;;;
891;19/01/2022 12:06;1;id;349801912;19/01/2022 12:00;19/01/2022 12:06;00:06:07;114.4.79.110;;Jakarta Smart City;Magda;;AB;Laki-laki;65+ tahun;Magister/Strata II;Pegawai Pemerintah Non PNS (PPSU, PJLP, dll.);;Rp 4.000.001 - Rp 6.500.000;Jakarta Pusat;KECAMATAN GAMBIR;KELURAHAN GAMBIR;3;1;Tidak;Ya;Ya;Tidak ingin menjawab;;Islam;;Cerai Mati;0;Tidak;Tidak;;Rumah tapak (tanah dan bangunan);;Rumah milik penuh;Jalan kecil (hanya bisa dilewati mobil satu arah);AC;Pipa PAM;Lebih panas;Sangat khawatir;;;Ojol/Taksol;;;Setiap hari;Sangat jarang;;< 30 menit;;Sangat aman;Sangat aman;Cukup aman;Cukup aman;Kadang tidak aman, kadang aman;Sangat aman;Cukup aman;Cukup aman;Cukup aman;Cukup aman;Sangat aman;;;Cukup taat;Selalu;Tidak setuju (agama urusan privat);;;Sangat nyaman;Cukup nyaman;Cukup nyaman;Cukup nyaman;;Agama tidak lebih penting dari kompetensi;;;Tidak penting;Tidak penting;Tidak penting;;Ya;Tidak;;;Cukup percaya;Cukup percaya;;;Sangat sering;Sangat sering;Sangat sering;;Kuat;;;Sering;Sering;;Lebih dari 10 keluarga;;;Sangat nyaman;Sangat nyaman;;Cukup percaya;Cukup percaya;Cukup percaya;Cukup percaya;Cukup percaya;Cukup percaya;;Sangat mudah dan cepat;Sangat mudah dan cepat;Sangat mudah dan cepat;Cukup mudah;Cukup mudah;;Lebih baik;Tidak optimis;Lebih baik;;Saya akan menghabiskan hidup di Jakarta;Sangat optimis Jakarta akan lebih baik;Tidak ada dampak;366,62;;;;;;;;;;;;;;;;;;;;;;;;;;;;;;;;;;;;;;;;;;;;;;;;;;;;;;;;;;;;;;;;;;;;;;;;;;;;;;;;;;;;;;;;;;;;;;;;;;;;;;;;;;;;;;;;;;;;;;;;;;;;;;;;
909;19/01/2022 12:19;1;id;;19/01/2022 12:00;19/01/2022 12:19;00:18:19;;;Unit Pengelola Statistik;Khoirun Nisa;;Rohmadi;Laki-laki;40-44 tahun;SLTP/Sederajat;Pegawai Pemerintah Non PNS (PPSU, PJLP, dll.);;Rp 4.000.001 - Rp 6.500.000;Jakarta Utara;KECAMATAN KOJA JAKARTA UTARA;KELURAHAN TUGU SELATAN;10;1;Tidak;Tidak;Ya;Lainnya;Jawa;Islam;;Menikah;01-Feb;Tidak;Ya;;Rumah tapak (tanah dan bangunan);;Menumpang (tidak bayar);Gang (hanya bisa dilewati motor);Kipas listrik;Pipa PAM;Lebih sejuk;Cukup khawatir;;;Sepeda motor;;;Sangat sering;Kadang-kadang;;< 30 menit;;Sangat aman;Sangat aman;Sangat aman;Cukup aman;Cukup aman;Kadang tidak aman, kadang aman;Cukup aman;Sangat aman;Cukup aman;Kadang tidak aman, kadang aman;Sangat aman;;;Sangat taat;Selalu;Tergantung situasi;;;Cukup nyaman;Cukup nyaman;Tidak nyaman;Cukup nyaman;;Agama tidak lebih penting dari kompetensi;;;Cukup penting;Tidak penting;Tidak penting;;Ya;Tidak;;;Cukup percaya;Sering tidak percaya;;;Sering;Sering;Sekali-sekali;;Sekali-sekali saja;;;Sering;Sekali-sekali;;Lebih dari 10 keluarga;;;Cukup nyaman;Cukup nyaman;;Tidak percaya;Cukup percaya;Cukup percaya;Cukup percaya;Cukup percaya;Cukup percaya;;Sangat mudah dan cepat;Cukup mudah;Cukup mudah;Sangat mudah dan cepat;Sangat mudah dan cepat;;Lebih buruk;Sangat optimis;Jauh lebih baik;;Saya akan terus bekerja di Jakarta dan mungkin akan pensiun di tempat lain;Sangat optimis Jakarta akan lebih baik;Cukup negatif;;;;;;;;;;;;;;;;;;;;;;;;;;;;;;;;;;;;;;;;;;;;;;;;;;;;;;;;;;;;;;;;;;;;;;;;;;;;;;;;;;;;;;;;;;;;;;;;;;;;;;;;;;;;;;;;;;;;;;;;;;;;;;;;;
